{
  "product_id": "FLK-IN-GHEF9XYZ12345678",
  "platform": "flipkart",
  "url": "https://www.flipkart.com/amul-pure-ghee-1-l-tetrapack/p/itmfc7f8e819b123?pid=GHEF9XYZ12345678",
  "title": "Flipkart Product Listing",
  "description": "",
  "seller_id": "FLK-SELLER-UNKNOWN",
  "listing_price": 0.0,
  "scraped_at": "2026-08-24T19:51:43.659289+05:30",
  "raw_html_sha256": "50af5dc2b68883dc236a68b11f3294e477fb714b1780d51c7ae27fcf60834faf",
  "images": [],
  "category": "other"
}