{
  "product_id": "AMZ-IN-FE853810DB",
  "platform": "amazon",
  "url": "https://www.amazon.in/dp/B09USB999",
  "title": "Portronics Konnect L 1.2M Fast Charging 3A Type-C Cable with Nylon Braiding",
  "description": "High speed data sync up to 480Mbps, 3A rapid charge, premium braided exterior.",
  "seller_id": "AMZ-SELLER-PORTRONICS-HQ",
  "listing_price": 199.0,
  "scraped_at": "2026-08-21T05:21:54.695283+05:30",
  "raw_html_sha256": "53a86dd29f5e7339a43d2fac955cc00735ae274ccc726c77130ce17e4e0f82bc",
  "images": [
    {
      "url": "https://images.unsplash.com/photo-1546868871-7041f2a55e12?w=600",
      "sha256": "2bd9e22076fc1c149afbf4c8996fb92427ae41e4649b934ca495991b7852b899"
    }
  ],
  "category": "electronics"
}