{
  "product_id": "MSH-IN-3VXYZ7",
  "platform": "meesho",
  "url": "https://www.meesho.com/p/3vxyz7",
  "title": "Access Denied",
  "description": "",
  "seller_id": "MSH-SELLER-UNKNOWN",
  "listing_price": 0.0,
  "scraped_at": "2026-08-24T19:52:19.330861+05:30",
  "raw_html_sha256": "710de59486816f0659495bfd6f07d584c8d1e353f83c7e7b2bb3b6c6c7664a23",
  "images": [],
  "category": "other"
}