{
  "product_id": "MSH-IN-69LQHI",
  "platform": "meesho",
  "url": "https://www.meesho.com/farmley-premium-date-bites-dry-fruit-barfi-200g/p/69lqhi",
  "title": "Meesho Product Listing",
  "description": "",
  "seller_id": "MSH-SELLER-UNKNOWN",
  "listing_price": 0.0,
  "scraped_at": "2026-08-24T21:00:39.593522+05:30",
  "raw_html_sha256": "257ce9dd017e54dea5cecb82bb49d4c625151f6c6e9e5575235f76de4f1a9876",
  "images": [],
  "category": "other"
}