{
  "product_id": "FLK-IN-PTYEA6SFGD4X8NAR",
  "platform": "flipkart",
  "url": "http://www.flipkart.com/kennel-rubber-dumbell-bell-small-toy-dog/p/itmea6sfmyuwwgjq?pid=PTYEA6SFGD4X8NAR",
  "title": "Kennel Rubber Dumbell With Bell - Small Rubber Rubber Toy For Dog",
  "description": "",
  "seller_id": "FLK-SELLER-UNKNOWN",
  "listing_price": 0.0,
  "scraped_at": "2026-08-23T15:33:03.855612+05:30",
  "raw_html_sha256": "34e9db3015cbd2889dc3bad23b37400bcc89c61bef7e0330e18626b2ae19d5b2",
  "images": [],
  "category": "other"
}