{
  "product_id": "FLK-IN-MSCFDZGKEHRGZW9U",
  "platform": "flipkart",
  "url": "https://www.flipkart.com/yardley-london-english-rose-moisturizing-hand-body-lotion-geranium-oil/p/itmc9e5dc38c9b02?pid=MSCFDZGKEHRGZW9U",
  "title": "Yardley London English Rose Moisturizing Hand & Body Lotion With ...more",
  "description": "",
  "seller_id": "FLK-SELLER-UNKNOWN",
  "listing_price": 267.0,
  "scraped_at": "2026-08-24T20:57:19.967358+05:30",
  "raw_html_sha256": "36bfcaa13e34d3445cfa6162c5b71d7b7919f8a0a72d2d587c67e918d4b50392",
  "images": [
    {
      "url": "https://rukminim2.flixcart.com/image/832/832/xif0q/moisturizer-cream/o/4/8/-original-imah89haputzj5dx.jpeg?q=90",
      "sha256": "1922b2321c398f0799ba662507dc37ad585f2768f864f953fc6a84494d705455"
    },
    {
      "url": "https://rukminim2.flixcart.com/image/832/832/xif0q/moisturizer-cream/a/5/a/-original-imah89happ6bzj9n.jpeg?q=90",
      "sha256": "08350e3aa481fa3037ba59353c4e4221a40061bb6ebed9737c0fd9c6703c338e"
    },
    {
      "url": "https://rukminim2.flixcart.com/image/832/832/xif0q/moisturizer-cream/r/z/t/-original-imah89hagsnqdgh4.jpeg?q=90",
      "sha256": "3cdd0256873ece87a00bd3eb825908a5f06e6202e8bfb26e2daaba2be70e4ed1"
    },
    {
      "url": "https://rukminim2.flixcart.com/image/832/832/xif0q/moisturizer-cream/i/v/m/-original-imah89has26heyyx.jpeg?q=90",
      "sha256": "901c890df47d9e8a4ec3a8a9af5c31ebf9c9eff6a3a7be71581e01e17e489f59"
    },
    {
      "url": "https://rukminim2.flixcart.com/image/832/832/xif0q/moisturizer-cream/k/c/x/600-winter-soft-milky-moisturizing-body-lotion-combo-pure-original-imagv8kym3eg8zxm.jpeg?q=90",
      "sha256": "e06b58863ae72eeb3da52b0ceac249fa35f34b6d141dc43b8f8c81ec4a313ffe"
    },
    {
      "url": "https://rukminim2.flixcart.com/image/832/832/xif0q/moisturizer-cream/w/h/6/-original-imahpgda6h9hhqx9.jpeg?q=90",
      "sha256": "63c9b1d36bd93fbc8b17a08f47c1811e18e8e18b6f65c0e82ef159ba8808268a"
    }
  ],
  "category": "cosmetics"
}